{
  "schemaVersion": 2,
  "slug": "chickenbro-generic-public-web-research",
  "requirementSlug": "chickenbro-generic-public-web-research",
  "status": "runtime_verified",
  "highestEvidenceLevel": "runtime_verified",
  "branch": "codex/chickenbro-agentic-research-loop",
  "commit": "05e3e65bf7bab3f2bb57bf3970d9ec28af1ba816",
  "identities": {
    "runtime": {
      "status": "bound",
      "kind": "git_commit",
      "value": "05e3e65bf7bab3f2bb57bf3970d9ec28af1ba816",
      "fileHashes": {
        "server/chickenbro_public_web_research.py": "5fb16eb60de347163c55fd5d1254d67237a1ffe3a30b091552ad3dfec138d5f2",
        "server/chickenbro_registry.py": "0be988d827c3c0c74063d1db5ec6fc6a5b625d348626e81bea553218c012a7f2",
        "server/chickenbro_research.py": "c3456b81ccfa45751da3c74fb1351f4a35d6f1b5bf38e760dda000fe237d4671",
        "server/chickenbro_tool_runtime.py": "ce265c8f3b8ffde1dde7cda944361515374cb799eb0561d47392bfd71465e015",
        "server/news_backend.py": "0c147eb94952b327684ca2b3145e9ba4ce133ba5018f390f186341adc183996c",
        "server/postgres_ops_store.py": "aa446fca8f6f43761dab4519a681e1fb980db73d23623079b8b64d47583b1fc5"
      }
    },
    "verification": {
      "status": "bound_at_check",
      "kind": "git_ref",
      "value": "HEAD"
    },
    "closure": {
      "status": "pending",
      "reason": "The user has not yet accepted the candidate WeChat behavior; no merge, production rollout or archive closure has occurred."
    }
  },
  "manualAcceptance": {
    "required": true,
    "status": "pending",
    "items": [
      {"id": "candidate_wechat_generic_current_research", "status": "pending"},
      {"id": "candidate_wechat_generic_natural_followup", "status": "pending"}
    ],
    "rollup": {
      "total": 2,
      "accepted": 0,
      "notRunUserWaived": 0,
      "pending": 2
    }
  },
  "scope": [
    "generic_public_web_research_tool",
    "candidate_registry_v5_without_active_pointer_change"
  ],
  "verification": [
    {
      "command": "python3 -m unittest -q tests.chickenbro_public_web_research_test tests.chickenbro_research_test tests.chickenbro_registry_test tests.chickenbro_tool_runtime_test tests.chickenbro_agent_test tests.postgres_ops_store_test tests.postgres_schema_test",
      "status": "pass",
      "summary": "132 项通用网页 Tool、ResearchPlan、Registry、runtime、agentic answer grounding/recovery、Postgres loader/schema 回归通过。"
    },
    {
      "command": "candidate API: 12.1 PTR Blood DK Mythic+ question, then natural same-session comparison follow-up",
      "status": "pass",
      "summary": "最终候选 127.0.0.1:18820 的首问 job 451d3b18-e8f4-41cd-a100-ca09d1526d2a 与同一 session 的追问 job 9743753d-cb7f-45b0-b5f5-2b0b3a586c87 均为 HTTP 200/succeeded；模型在实际 observations 后自行选择通用网页 Tool，追问未出现重试阻断。"
    },
    {
      "command": "candidate WeChat package build and DevTools open",
      "status": "pass",
      "summary": "候选小程序包 214 个文件通过身份校验，gitHead=05e3e65bf7bab3f2bb57bf3970d9ec28af1ba816，sourceHash=sha256:e3c473bb624e02c244ae5eec44fbed5304bc74edee272dc5591f22f528dbb466；包内候选 API 为本机隧道 127.0.0.1:18817，DevTools CLI 已打开该隔离包。"
    },
    {
      "command": "controlled local tunnel exit, launchd restart, then /health and chat stream OPTIONS through 127.0.0.1:18817",
      "status": "pass",
      "summary": "截图中的 ERR_CONNECTION_REFUSED 被复现为本机一次性 SSH 隧道已退出；远端候选 service 仍为 active、NRestarts=0、18820/health=200。受 launchd 守护后，主动终止旧 tunnel PID 90309 自动恢复为 PID 90615（runs=2），候选 /health 与 /api/chickenbro/messages/stream OPTIONS 均返回 200。"
    },
    {
      "command": "local CR: inspect generic Tool boundary, Registry v5 wiring, answer grounding and candidate diff",
      "status": "pass",
      "summary": "未发现职业、版本或提供方专用路由；Tool 仅支持安全公开 HTTPS、有界读取和已发布 manifest。运行时预算与 ResearchPlan 的通用上限一致，模型引用合同失败只会回退到本轮 observations 的保守回答。"
    }
  ],
  "candidateDeployment": {
    "status": "candidate_verified",
    "requiredBeforeMerge": true,
    "branch": "codex/chickenbro-agentic-research-loop",
    "commit": "05e3e65bf7bab3f2bb57bf3970d9ec28af1ba816",
    "deployedTarget": "ubuntu@124.223.51.33:/opt/wow-mini-program-candidates/chickenbro-generic-web-05e3e65b",
    "service": "wow-backend-chickenbro-generic-web-05e3e65b.service (127.0.0.1:18820)",
    "runtime": {
      "health": {"httpStatus": 200, "path": "/health", "nRestarts": 0},
      "fileParity": "六个运行文件 SHA-256 逐一与 05e3e65b 本地文件相等。",
      "registry": "candidate health 返回 chickenbro-tools-5（六个 active Tool，含 source:public-web-research:v2）；共享 production active pointer 保持 chickenbro-tools-3。",
      "localTunnel": "候选包继续只使用 127.0.0.1:18817；本机 GUI LaunchAgent 守护 SSH 到远端回环 18820，并以 KeepAlive/RunAtLoad 在连接退出后重建。"
    },
    "smoke": {
      "status": "pass",
      "firstJobId": "451d3b18-e8f4-41cd-a100-ca09d1526d2a",
      "followUpJobId": "9743753d-cb7f-45b0-b5f5-2b0b3a586c87",
      "sessionId": "fbe4453e-a9dd-44c4-9ee3-c7f92ce65e9c",
      "summary": "首问和自然追问均返回 200/succeeded；通用 Tool 返回公开页面引用，回答保持 PTR 与正式服、场景和证据强度边界。"
    },
    "timerBackflow": {
      "status": "pass",
      "newAsyncSyncOrBackfillStarted": false,
      "collectorOrRefreshJobsStarted": 0,
      "productionWowBackendChanged": false,
      "observedConfig": "WOW_DEPLOY_START_ASYNC_SYNCS=0，WOW_NEWS_ENABLE_COLLECTORS=0。"
    },
    "rollback": {
      "status": "ready",
      "path": "sudo systemctl stop wow-backend-chickenbro-generic-web-05e3e65b.service",
      "localTunnel": "launchctl bootout gui/<uid>/com.wow-mini-program.chickenbro-candidate-tunnel；移除对应的用户 LaunchAgent plist。",
      "production": "生产 wow-backend.service 与 production Registry active pointer 未被候选部署修改。"
    }
  },
  "runtimeEvidence": [
    {
      "type": "candidate_file_parity",
      "status": "pass",
      "summary": "最终候选六个运行文件 SHA-256 与 05e3e65b 对应本地文件一致。"
    },
    {
      "type": "natural_followup_smoke",
      "status": "pass",
      "summary": "同一会话的首问与追问均为 succeeded；自然追问没有返回 retry/send blocker。"
    },
    {
      "type": "agentic_validation_recovery",
      "status": "pass",
      "summary": "模型 claimRefs 格式失效时，服务只返回本轮真实 observations 的保守 partial，不再把用户送到 503 重试。"
    },
    {
      "type": "candidate_wechat_package",
      "status": "pass",
      "summary": "DevTools 已打开绑定 05e3e65b 的隔离候选包；真实用户验收仍待完成。"
    },
    {
      "type": "candidate_tunnel_supervision",
      "status": "pass",
      "summary": "原一次性本机 SSH 转发退出导致 DevTools ERR_CONNECTION_REFUSED；候选专用 launchd agent 已验证可在受控退出后自动重建，且 127.0.0.1:18817 的聊天流路由可到达后端。"
    }
  ],
  "risks": [
    {
      "id": "public_search_availability",
      "status": "active",
      "detail": "Public query discovery may be rate limited; each unsuccessful attempt remains a literal partial result and cannot become an invented conclusion."
    },
    {
      "id": "manual_wechat_acceptance",
      "status": "active",
      "detail": "候选包已在 DevTools 打开，但用户仍需验收当前问题的回答与自然追问体验；API 与构建通过不替代人工验收。"
    },
    {
      "id": "candidate_latency",
      "status": "active",
      "detail": "通用网页研究会经历多次受限读取，真实请求仍可能接近分钟级；本次只证明正确完成，不把当前时延包装为性能验收。"
    }
  ],
  "rollback": [
    "停止 wow-backend-chickenbro-generic-web-05e3e65b.service；生产服务保持不动。",
    "卸载并移除本机候选 tunnel LaunchAgent；候选包不再有可用的本机候选端口。",
    "保留候选 root 直至用户人工验收；如撤销候选可停止 service 后移除该单独 root。",
    "production_registry_pointer_unchanged"
  ],
  "cleanup": {
    "required": true,
    "status": "pending_user_acceptance",
    "target": "Keep the candidate service, supervised local tunnel, task branch and worktree until the user explicitly accepts or rejects the candidate behavior."
  },
  "archivedReferences": [
    "docs/plans/2026-08-04-chickenbro-agentic-research-loop-implementation.md"
  ],
  "summary": "候选 v5 Registry 已以 05e3e65b 部署：Codex 自主选择已发布的只读 ToolBox，通用 public-web-research Tool 只接受其选择的短查询或安全公开 HTTPS 页面，不为 Archon、Raider.IO、WCL、职业、版本或结论写固定路由。ResearchPlan 与 runtime 的通用调用上限一致；模型引用合同失败会以本轮 observations 的保守回答恢复，而不阻断追问。真实首问和自然追问均已在最终候选 API 成功；候选微信包已绑定该提交并在 DevTools 打开。候选本机 tunnel 现由 launchd 守护，连接退出后会自动重建。生产服务与 v3 active pointer 未改。真实用户验收仍是未完成边界。"
}
